{
  "schema_version": "6.0.0",
  "metadata": {
    "run_id": "2025-09-21__2025-11-25",
    "source_urls": {
      "airbnb": "https://data.insideairbnb.com/portugal/lisbon/lisbon/2025-09-21/data/listings.csv.gz",
      "official": "https://hub.arcgis.com/api/download/v1/items/4e62eb1977564991bd01e61d7aa8266f/csv?redirect=false&layers=6"
    },
    "source_dates": {
      "airbnb_snapshot_date": "2025-09-21",
      "official_register_date": "2025-08-26",
      "official_register_download_date": "2025-11-25"
    },
    "source_files": {
      "airbnb": {
        "sha256": "2287b386fcba69e48dd29668deab74c111f32e02a7ca184fd4824cc0be779b56"
      },
      "official": {
        "sha256": "7e5f65f823bc8e4af6bcd9add13e25e01154f63492e927495689398e2b071242"
      }
    },
    "git_commit": "dd50aab96ce1e30157a205cdb35ddd9f2d5f6c86",
    "git_worktree_dirty": true,
    "analysis_version": "3.4.0",
    "methodology_version": "2.1.0",
    "output_schema_version": "6.0.0",
    "mode": "public"
  },
  "summary": {
    "run_id": "2025-09-21__2025-11-25",
    "source_dates": {
      "airbnb_snapshot_date": "2025-09-21",
      "official_register_date": "2025-08-26",
      "official_register_download_date": "2025-11-25"
    },
    "methodology_version": "2.1.0",
    "listings": 17428,
    "licence_groups": 8950,
    "official_registers_lisbon": 18561,
    "establishment_estimate": 14863,
    "classifications": {
      "licença repetida em várias localizações": 149,
      "licença oficial fora de Lisboa": 390,
      "licença única em Lisboa": 6758,
      "número sem correspondência no RNAL": 659,
      "licença repetida na mesma localização": 179,
      "provável estabelecimento com anúncios múltiplos": 815
    },
    "mode": "public",
    "generated_at": "2026-10-12T21:16:50Z",
    "historical_comparisons": []
  },
  "licence_group_aggregates": [
    {
      "classification": "licença oficial fora de Lisboa",
      "official_municipality": "outro município",
      "official_type": "apartamento",
      "licence_groups": 347,
      "announcements": 744,
      "spatial_locations": 388,
      "estimated_establishments": 744
    },
    {
      "classification": "licença oficial fora de Lisboa",
      "official_municipality": "outro município",
      "official_type": "hospedagem",
      "licence_groups": 43,
      "announcements": 65,
      "spatial_locations": 43,
      "estimated_establishments": 65
    },
    {
      "classification": "licença repetida em várias localizações",
      "official_municipality": "Lisboa",
      "official_type": "apartamento",
      "licence_groups": 114,
      "announcements": 404,
      "spatial_locations": 239,
      "estimated_establishments": 404
    },
    {
      "classification": "licença repetida em várias localizações",
      "official_municipality": "Lisboa",
      "official_type": "hospedagem",
      "licence_groups": 16,
      "announcements": 133,
      "spatial_locations": 37,
      "estimated_establishments": 133
    },
    {
      "classification": "licença repetida em várias localizações",
      "official_municipality": "não identificado",
      "official_type": "não identificado",
      "licence_groups": 19,
      "announcements": 288,
      "spatial_locations": 98,
      "estimated_establishments": 288
    },
    {
      "classification": "licença repetida na mesma localização",
      "official_municipality": "Lisboa",
      "official_type": "apartamento",
      "licence_groups": 179,
      "announcements": 431,
      "spatial_locations": 179,
      "estimated_establishments": 179
    },
    {
      "classification": "licença única em Lisboa",
      "official_municipality": "Lisboa",
      "official_type": "apartamento",
      "licence_groups": 6523,
      "announcements": 6523,
      "spatial_locations": 6523,
      "estimated_establishments": 6523
    },
    {
      "classification": "licença única em Lisboa",
      "official_municipality": "Lisboa",
      "official_type": "hospedagem",
      "licence_groups": 235,
      "announcements": 235,
      "spatial_locations": 235,
      "estimated_establishments": 235
    },
    {
      "classification": "número sem correspondência no RNAL",
      "official_municipality": "não identificado",
      "official_type": "não identificado",
      "licence_groups": 659,
      "announcements": 971,
      "spatial_locations": 659,
      "estimated_establishments": 971
    },
    {
      "classification": "provável estabelecimento com anúncios múltiplos",
      "official_municipality": "Lisboa",
      "official_type": "apartamento",
      "licence_groups": 438,
      "announcements": 1322,
      "spatial_locations": 438,
      "estimated_establishments": 438
    },
    {
      "classification": "provável estabelecimento com anúncios múltiplos",
      "official_municipality": "Lisboa",
      "official_type": "hospedagem",
      "licence_groups": 377,
      "announcements": 1806,
      "spatial_locations": 377,
      "estimated_establishments": 377
    },
    {
      "classification": "sem licença",
      "official_municipality": "não identificado",
      "official_type": "não identificado",
      "licence_groups": 0,
      "announcements": 669,
      "spatial_locations": 0,
      "estimated_establishments": 669
    },
    {
      "classification": "sem licença identificável",
      "official_municipality": "não identificado",
      "official_type": "não identificado",
      "licence_groups": 0,
      "announcements": 3837,
      "spatial_locations": 0,
      "estimated_establishments": 3837
    }
  ],
  "announcements_by_parish_and_classification": [
    {
      "freguesia": "Ajuda",
      "classification": "licença oficial fora de Lisboa",
      "announcements": 10,
      "announcements_with_identifiable_number": 10,
      "estimated_establishments": 10
    },
    {
      "freguesia": "Ajuda",
      "classification": "licença repetida em várias localizações",
      "announcements": 9,
      "announcements_with_identifiable_number": 9,
      "estimated_establishments": 9
    },
    {
      "freguesia": "Ajuda",
      "classification": "licença repetida na mesma localização",
      "announcements": 5,
      "announcements_with_identifiable_number": 5,
      "estimated_establishments": 2
    },
    {
      "freguesia": "Ajuda",
      "classification": "licença única em Lisboa",
      "announcements": 113,
      "announcements_with_identifiable_number": 113,
      "estimated_establishments": 113
    },
    {
      "freguesia": "Ajuda",
      "classification": "número sem correspondência no RNAL",
      "announcements": 8,
      "announcements_with_identifiable_number": 8,
      "estimated_establishments": 8
    },
    {
      "freguesia": "Ajuda",
      "classification": "provável estabelecimento com anúncios múltiplos",
      "announcements": 50,
      "announcements_with_identifiable_number": 50,
      "estimated_establishments": 16
    },
    {
      "freguesia": "Ajuda",
      "classification": "sem licença",
      "announcements": 7,
      "announcements_with_identifiable_number": 0,
      "estimated_establishments": 7
    },
    {
      "freguesia": "Ajuda",
      "classification": "sem licença identificável",
      "announcements": 39,
      "announcements_with_identifiable_number": 0,
      "estimated_establishments": 39
    },
    {
      "freguesia": "Alcântara",
      "classification": "licença oficial fora de Lisboa",
      "announcements": 17,
      "announcements_with_identifiable_number": 17,
      "estimated_establishments": 17
    },
    {
      "freguesia": "Alcântara",
      "classification": "licença repetida em várias localizações",
      "announcements": 9,
      "announcements_with_identifiable_number": 9,
      "estimated_establishments": 9
    },
    {
      "freguesia": "Alcântara",
      "classification": "licença repetida na mesma localização",
      "announcements": 6,
      "announcements_with_identifiable_number": 6,
      "estimated_establishments": 2
    },
    {
      "freguesia": "Alcântara",
      "classification": "licença única em Lisboa",
      "announcements": 134,
      "announcements_with_identifiable_number": 134,
      "estimated_establishments": 134
    },
    {
      "freguesia": "Alcântara",
      "classification": "número sem correspondência no RNAL",
      "announcements": 10,
      "announcements_with_identifiable_number": 10,
      "estimated_establishments": 10
    },
    {
      "freguesia": "Alcântara",
      "classification": "provável estabelecimento com anúncios múltiplos",
      "announcements": 49,
      "announcements_with_identifiable_number": 49,
      "estimated_establishments": 11
    },
    {
      "freguesia": "Alcântara",
      "classification": "sem licença",
      "announcements": 12,
      "announcements_with_identifiable_number": 0,
      "estimated_establishments": 12
    },
    {
      "freguesia": "Alcântara",
      "classification": "sem licença identificável",
      "announcements": 83,
      "announcements_with_identifiable_number": 0,
      "estimated_establishments": 83
    },
    {
      "freguesia": "Alvalade",
      "classification": "licença oficial fora de Lisboa",
      "announcements": 24,
      "announcements_with_identifiable_number": 24,
      "estimated_establishments": 24
    },
    {
      "freguesia": "Alvalade",
      "classification": "licença repetida em várias localizações",
      "announcements": 25,
      "announcements_with_identifiable_number": 25,
      "estimated_establishments": 25
    },
    {
      "freguesia": "Alvalade",
      "classification": "licença repetida na mesma localização",
      "announcements": 5,
      "announcements_with_identifiable_number": 5,
      "estimated_establishments": 2
    },
    {
      "freguesia": "Alvalade",
      "classification": "licença única em Lisboa",
      "announcements": 65,
      "announcements_with_identifiable_number": 65,
      "estimated_establishments": 65
    },
    {
      "freguesia": "Alvalade",